{
  "discovery": {
    "data_sources": ["defillama"],
    "default_chain": "ethereum",
    "min_apy": 0,
    "max_results": 20
  },
  "trading": {
    "mode": "simulation",
    "wallet_type": "metamask",
    "default_limit_usd": 100,
    "whitelist_enabled": true
  },
  "portfolio": {
    "chain": "ethereum",
    "track_expiry": true,
    "expiry_warning_days": 7
  },
  "risk_preferences": {
    "max_risk_level": "medium",
    "min_tvl_usd": 1000000,
    "require_audit": false,
    "min_protocol_age_days": 0
  },
  "notifications": {
    "expiry_channel": "none",
    "trade_channel": "none"
  }
}